codigo;nombre;fecha_ejecucion;descripcion;entidad;lider;cargo_lider;plataforma;crm
CB-NO-EX-N/A-CRM78092-PRD;Unificación de cuentas;16/02/2026;Mediante el CRM 78029 se solicita acceso al usuario administrativo de Banco de Occidente para realizar el proceso de unificación de cuentas de los comercios relacionados con el CRM de servicio al cliente 36538, dado que la información quedó incompleta debido a una novedad presentada en la disposición de los archivos, requiriendo la unificación para garantizar la integridad de los datos de los comercios.;BPO Banco de Occidente;Cesar Galán;Analista gestión de incidentes;AS400;78092
CB-NO-EX-N/A-78086-PDCL;Retrasmision de las interfaces contables por dscuadra CRM productivo 36578;16/02/2026;Se radica el CRM 78086 con el proposito de realizar las interfaces contables del usuario administrativo para dar alcance al CRM productivo 36578 ;BPO Claro;Wilmer Galvis;Analista de certificación;AS400;78086
CB-NO-EX-N/A-CRM77805-PRD;Restauración de archivos;16/02/2026;Se solicita la restauración de la tabla CJES del backup inicial y final correspondientes a los días 30 y 31 de octubre, ya que la entidad, mediante el CRM de servicio al cliente 36343, requiere identificar el usuario que activó el indicador de reteica. Se evidencia que desde el 31 de octubre hasta el 3 de febrero el comercio cobró reteica sin que la entidad lo detectara. Ahora la entidad desactivará nuevamente el indicador y solicita conocer el usuario responsable para realizar las indagaciones pertinentes.;BPO Banco de Occidente;Cesar Galán;Analista gestión de incidentes;AS400;77805
CB-EM-EX-AS244905-78096-PRB;CRM8535 - Consulta de pestaña TC datos generales Error;16/02/2026;Se requiere el archivo CRMAE para el proyecto de modernización de Débito Automático, debido a que la Consulta TC Datos Generales presenta fallas cuando el campo MAEOCT del maestro tiene valores distintos de cero. Ante la pregunta “¿Cuál es la afectación en producción crítica que está deteriorando el servicio?”, se indica que el motor de consulta valida el campo MAEOCT y, al encontrarlo poblado, bloquea la ejecución, genera error y deja la consulta en estado fallido, ocasionando indisponibilidad funcional e impactando la operación diaria. Ante la pregunta “¿Por qué no se puede esperar a los tiempos del procedimiento?”, se explica que la falla es sistemática —no intermitente— y continuará mientras el campo permanezca diligenciado, lo que genera acumulación de casos, riesgo de incumplimiento de SLA, reprocesos y posibles errores operativos, sin existir una mitigación temporal viable sin modificar el dato.;BPO Banco Agrario;Rafael Galvis;Ingeniero de proyectos;AS400;78096
CB-NO-IN-N/A-CRM  78106-PDCL;NOVEDAD ESTADO DE TDC;16/02/2026;Se realiza la ejecución del programa de alcance en el CRM, mediante el usuario Admin, para la gestión de 35.450 clientes con inconveniente en estado de TDC. El cambio da continuidad a los procesos definidos en los comités 77828, 77868 y 77810, incluyendo los clientes nuevos afectados a la fecha, conforme a la solución final establecida el 27 de febrero de 2028. Adicionalmente, se corrige de manera inmediata un conjunto de clientes no reportados por la entidad en el CRM (35.949 casos), afectados por el cambio masivo de estado realizado en la BPO.;BPO Banco Unión;Stefania Andrade;Experto funcional;AS400 -  JAVA;78106
CB-EM-EX-N/A-78107-PDCL;CRM36578 - No se ha recibido archivos de interfaces contables;16/02/2026;Se requiere realizar un despliegue urgente a producción desde NimbusQA hacia NAOS/NIMBUS para la entidad Claro, con el fin de estabilizar el proceso contable afectado por la versión actualmente desplegada, la cual ha generado inconsistencias en la malla productiva evidenciadas en el PAP del 09/02/2028 y reportadas bajo el tiquete 38578. Ante la pregunta “¿Cuál es la afectación en producción crítica que está deteriorando el servicio?”, se indica que la malla productiva presenta fallas en la generación del proceso contable, ya que las interfaces que deben entregarse a primera hora del día se están produciendo con descuadres significativos, obligando a realizar conciliaciones manuales y generando retrasos en la entrega al cliente. Ante la pregunta “¿Por qué no se radicó y presentó bajo los tiempos establecidos del procedimiento de gestión de cambios y por qué no puede esperar?”, se explica que la criticidad del impacto y el alto nivel de descuadres impiden su paso por comité regular, dado que la demora incrementa el riesgo operativo y ocasiona que las interfaces sean entregadas tardíamente, afectando el nivel de servicio.;BPO Claro;Orlando Guerrero;Líder técnico;AS400;78107
