codigo;nombre;fecha_ejecucion;descripcion;entidad;lider;cargo_lider;plataforma;crm
CB-NO-IN-N/A-77988-PRB;Error Aplicación de la transacción PMA cliente con pago;19/02/2026;Se realiza la solicitud correspondiente al CRM 77988 la cual precisa traer información del ambiente productivo NAOS PCI a NIMBUS QA para validar el funcionamiento que ha venido presentando fallas, dicha información de los archivos corresponde a los siguientes: GATMP GYF/ITR0000219 y GATMPGYF/FNE0000220. El objetivo es que se puedan alojar en la librería PUENTEGYF correspondiente a la entidad todos los datos que en los archivos se encuentran y que han sido previamente buscados.;BPO Banco Unión;Keyner Caraballo;Experto funcional;AS400;77988
CB-NO-EX-N/A-CRM78242-PRD;Validación código de rechazo;19/02/2026;La solicitud consiste en la habilitación del usuario administrador del banco del occidente con propósito de realizar el proceso de unificación de cuentas a los comercios deportados en el CRM de servicio al cliente 36694 en el cuál no lograron hacer el match correspondiente dada la novedad que se presenta en los archivos, que contempla la no asignación de días restantes adecuada.;BPO Banco Mundo Mujer;Kevin Martinez;Analista de certificación;AS400;78242
CB-NO-IN-N/A-78244-PRD;SOLUCIÓN ERROR PRODUCCIÓN MEJORA EN REEXPEDICIÓN Y CANCELACIÓN DE TARJETAS ;19/02/2026;Se solicita la restauración del AUARCHBMM/AUCAF para la fecha 2026/01/31 dado que se requiere validar la fecha de vencimiento asociada a la tarjeta para ese día. Se solicita que el archivo AUCAF que se restaure con otro nombre en otra ruta.;BPO AS•NET;Keyner Caraballo;Experto funcional;AS400;78244
CB-NO-EX-N/A-CRM78243-PRD;Unificación de cuentas;19/02/2026;Se presenta al comité de cambios el CRM 78251 que considera la la corrección de estados. Con el propósito de corregir inconsistencias en los estados de los clientes y dar solución oportuna al CRM 36219.;BPO Banco de Occidente;Cesar Galan;Analista gestion de incidentes;AS400;78243
CB-NO-IN-N/A-CRM 78251-PDCL;NOVEDAD ESTADO DE TDC;19/02/2026;"Se realiza la solicitud emergente ante el comité bajo el CRM 78244 que tiene como objetivo dar paso al ajuste implementado en el CRM 36383 el cual consiste en la modificación del proceso de cancelación y expedición de billeteras, dado que actualmente se está presentando un inconveniente en estos procesos lo que genera una indisponibilidad en los mismos.
¿Cuál es la afectación en producción crítica que está deteriorando el servicio? 
Keyner indica que actualmente no se está realizando el proceso de reexpedición y cancelación de tarjetas.
¿Por qué no se radicó y presentó por los tiempos establecidos en el procedimiento de gestión de cambios, y por qué no se puede esperar a estos?
Se explica que no se puede esperar porque se está presentando una afectación en los procesos ";BPO Banco Unión;Camilo Cardozo;Analista de certificación;AS400 -  JAVA;78251
