codigo;nombre;fecha_ejecucion;descripcion;entidad;lider;cargo_lider;plataforma;crm
CB-NO-IN-21446-78501-PRD;SALDOS BILLETERA;27/02/2026;"Se presenta al comité de cambios el CRM 78501 referente a la generación del archivo de saldos de billetera para la entidad Banco Agrario, correspondiente a la fecha del 26 de febrero de 2026. El desarrollo solicitado consiste en generar dicho archivo para ser utilizado como insumo obligatorio en el proceso de facturación de la entidad, con el fin de conocer la totalidad de las billeteras y sus estados actuales. Es necesario contar con las cifras antes de las 15:00 horas del día 27 de febrero para cumplir con los tiempos de facturación y posterior entrega al cliente. Las actividades del plan de trabajo se centran en la extracción y entrega del archivo técnico denominado ""SaldosBilleteraCDMMYYYY.TXT"". El riesgo e impacto de esta actividad se consideran bajos, ya que se trata de una labor de generación de información consultiva sin afectación a la transaccionalidad.";Banco Agrario;Yeymmi Pinzon ;Analista de operaciones;N/A;78501
CB-NO-EX-N/A-CRM78508-PRD;Unificación de cuentas;27/02/2026;"Se justifica el CRM 78508 referente al CRM de servicio al cliente 37049 para el procesamiento de los archivos ""ESTABLE"" y ""CCVIS"" desde el 17 de febrero hasta el 24 de febrero de 2026. El desarrollo solicitado consiste en realizar la recepción y procesamiento de estos archivos para lograr la afiliación de comercios y permitir la visualización de los mismos en el aplicativo, dado que la entidad presentaba inconvenientes con la disposición de estos en la ruta debido a problemas de red ya solventados. El periodo de los archivos abarca desde mediados de febrero hasta el día 24 del mismo mes. Las actividades clave del plan de trabajo incluyen el procesamiento técnico de los archivos acumulados para normalizar la base de comercios afiliados. El riesgo e impacto se consideran bajos, orientados a la actualización de información de comercios sin afectar la transaccionalidad en tiempo real. ";BPO Banco de Occidente;Cesar Galan;Analista gestión de incidentes;AS400;78508
CB-EM-IN-NA-78517-PRD;Actualización Firewall Naos;27/02/2026;"La solicitud del CRM 78517 surge por la necesidad de actualizar versiones de firewall para mitigar vulnerabilidades acumuladas reportadas por el fabricante. El ajuste técnico consiste en migrar a una versión estable que solvente estos fallos de seguridad, los cuales actualmente solo cuentan con mitigaciones temporales a nivel de configuración. Adicionalmente, se explica que la migración de clientes al Data Center de Nimbus realizada ayer ha dejado al Data Center de Naos con bajo tráfico, lo que brinda una ventana ideal para la ejecución. El plan de trabajo aprovecha esta baja carga transaccional para actualizar el entorno de Naos sin impactar la operación de los clientes. El riesgo de mantener el estado actual radica en la permanencia de versiones desactualizadas expuestas a vulnerabilidades conocidas, por lo que se tramita como una intervención emergente. 

Antes las siguientes preguntas: 

¿Cuál es la afectación en producción critica qué está deteriorando el servicio?RTA:
Se indica que se presenta acumulación de vulnerabilidades reportadas por el fabricante y bugs de versión
¿Por qué no se radico y presento por los tiempos establecidos en el procedimiento de gestión de cambios, y porque no se puede esperar a estos?
Se explica que debido a la afectación del día 26 de febrero en el data center del Naos, los clientes fueron migrados al data center de Nimbus, por lo cual se va a aprovechar la disminución del trafico en el data center de Naos para realizar la actividad.";AS•NET;Francisco Cortes;Administrador de redes y seguridad;N/A;78517
CB-NO-EX-N/A-CRM78514-PRD;Restauración de archivos;27/02/2026;La solicitud del CRM 78514 corresponde a un ajuste en el ambiente productivo para la restauración de archivos de la entidad BAN100, asociados al requerimiento de servicio al cliente 37064. El desarrollo consiste en restaurar los archivos del cliente L046231204 y L046250730 con el objetivo de suministrar la información técnica que el banco requiere para atender sus validaciones internas. Respectivamente al estado previo de este requerimiento, la solicitud vinculada al CRM 37064 ya cuenta con aprobación. El plan de trabajo establece la ejecución de la restauración de datos el día 27 de febrero de 2026. El riesgo e impacto de la actividad se consideran mínimos, dado que se trata de una recuperación de información histórica para fines de consulta del cliente sin alteración de la transaccionalidad actual. Finalmente, el cambio cuenta con la aprobación del comité según la decisión registrada para el CRM 78514.;BPO Ban 100;Angel Romero;Analista gestión de incidentes;AS400;78514
CB-NO-IN-N/A-78521-PRD;Validación de estado de tarjetas en archivo crcob;27/02/2026;La solicitud del CRM 78531 busca la activación de un usuario administrador para gestionar el cambio de estado de tarjetas que presentan afectaciones. Esta intervención técnica es necesaria para dar continuidad al ajuste que se está manejando bajo el CRM 35213, permitiendo normalizar la situación de las tarjetas impactadas. El objetivo de la habilitación del perfil administrador, se responde que es indispensable para ejecutar de forma directa el cambio de estado en el sistema. El plan de trabajo contempla la asignación del permiso y la ejecución de la corrección de forma inmediata tras obtener la autorización. El riesgo de la operación se considera controlado al estar vinculado a un proceso de remediación previamente identificado y escalado. Finalmente, el cambio queda a la espera de los comentarios y la validación final por parte del comité para proceder con la activación.;BPO AS•NET;Keyner Caraballo;Experto funcional;AS400;78521
